{"audit_software_identity":"git:374ddcc7d9763f7a991818cab4eaf4ce0cd7614b","bindings":{"canonical_manifest_sha256":"2b9f6cce69be8bec260b1745c4380e2278bdfdd96d6d1438f79ce5c664269117","capacity_evidence_sha256":"2363e5795c108186764f098e572388c6bf61185f77ab342c07e1fc61b2ac46d0","history_manifest_sha256":"4e5571d82a7acf83e10f816560703c82cdbcce18a37910c709cae72b11a2e4d0","instrument_registry_sha256":"4024ded8a34718e6658dcddd34b290f757b030e6c34b07401568b8aeadae910d","publisher_software_identity":"git:0f3b0a164c7f7f9765b0d77168e56f4957368fcf"},"content_sha256":"2893370de205025be6a5cd4ef34f7047056dcfb9a8e2b05a32531a664a358d97","contract":"grid.canonical-1m-coverage-audit/v1","dataset_id":"trade-1m-4e5571d82a7acf83e10f8165","dataset_type":"trade_kline_1m","gap_evidence":{"gap_range_count":0,"gap_ranges_sha256":"4f53cda18c2baa0c0354bb5f9a3ecbe5ed12ab4d8e11ba873c2f11161202b945","sample_limit":20,"sample_ranges":[],"sample_truncated":false},"generated_at_utc":"2026-08-12T20:15:47.650522Z","limitations":["Coverage is evaluated only inside the explicitly requested series ranges.","Current registry lifecycle bounds do not prove a complete dated historical universe.","REST-returned gaps remain unaccepted and block completion until a separate policy or repair resolves them.","This audit does not repair data, compact files, register a catalog entry, or close Gate 2."],"quality":{"canonical_source_table_equal":true,"conflicting_key_count":0,"duplicate_key_count":0,"expected_minute_count":20160,"lifecycle_failure_count":0,"missing_minute_count":0,"observed_row_count":20160,"unexpected_timestamp_count":0,"unrequested_row_count":0},"reason_policy":{"accepted_reason_codes":[],"observed_reason_counts":{},"unaccepted_reason_codes":[],"unknown_reason_count":0},"series":[{"duplicate_key_count":0,"end_ms":1783468740000,"expected_minute_count":10080,"gap_range_count":0,"instrument_id":5,"missing_minute_count":0,"observed_row_count":10080,"start_ms":1782864000000,"symbol":"BTCUSDT","unexpected_timestamp_count":0,"within_registry_lifecycle_bounds":true},{"duplicate_key_count":0,"end_ms":1783468740000,"expected_minute_count":10080,"gap_range_count":0,"instrument_id":29,"missing_minute_count":0,"observed_row_count":10080,"start_ms":1782864000000,"symbol":"UNIUSDT","unexpected_timestamp_count":0,"within_registry_lifecycle_bounds":true}],"status":"passed","storage_policy":{"account_data_included":false,"market_values_included":false,"runtime_paths_included":false}}
