{"audit_software_identity":"git:241928fd1301ece26b60495f12375f603dcd0777","bindings":{"canonical_manifest_sha256":"57006c34d1315bc395777f44a6b22487ac9afb8e884c72d7cf8d6e51d0f03dc7","capacity_evidence_sha256":"2363e5795c108186764f098e572388c6bf61185f77ab342c07e1fc61b2ac46d0","history_manifest_sha256":"6e7791e71fe8c2d6e8212680c4e2127ed5030f40684d9bb5767c17aeff40a0bd","instrument_registry_sha256":"4024ded8a34718e6658dcddd34b290f757b030e6c34b07401568b8aeadae910d","publisher_software_identity":"git:241928fd1301ece26b60495f12375f603dcd0777"},"content_sha256":"7ea7b4cc95d20ccbea074284a3d35c82b753070affef33083ce403991cd749c8","contract":"grid.canonical-1m-coverage-audit/v1","dataset_id":"trade-1m-6e7791e71fe8c2d6e8212680","dataset_type":"trade_kline_1m","gap_evidence":{"gap_range_count":0,"gap_ranges_sha256":"4f53cda18c2baa0c0354bb5f9a3ecbe5ed12ab4d8e11ba873c2f11161202b945","sample_limit":20,"sample_ranges":[],"sample_truncated":false},"generated_at_utc":"2026-08-13T07:49:26.964322Z","limitations":["Coverage is evaluated only inside the explicitly requested series ranges.","Current registry lifecycle bounds do not prove a complete dated historical universe.","REST-returned gaps remain unaccepted and block completion until a separate policy or repair resolves them.","This audit does not repair data, compact files, register a catalog entry, or close Gate 2."],"quality":{"canonical_source_table_equal":true,"conflicting_key_count":0,"duplicate_key_count":0,"expected_minute_count":100800,"lifecycle_failure_count":0,"missing_minute_count":0,"observed_row_count":100800,"unexpected_timestamp_count":0,"unrequested_row_count":0},"reason_policy":{"accepted_reason_codes":[],"observed_reason_counts":{},"unaccepted_reason_codes":[],"unknown_reason_count":0},"series":[{"duplicate_key_count":0,"end_ms":1783468740000,"expected_minute_count":10080,"gap_range_count":0,"instrument_id":5,"missing_minute_count":0,"observed_row_count":10080,"start_ms":1782864000000,"symbol":"BTCUSDT","unexpected_timestamp_count":0,"within_registry_lifecycle_bounds":true},{"duplicate_key_count":0,"end_ms":1783468740000,"expected_minute_count":10080,"gap_range_count":0,"instrument_id":29,"missing_minute_count":0,"observed_row_count":10080,"start_ms":1782864000000,"symbol":"UNIUSDT","unexpected_timestamp_count":0,"within_registry_lifecycle_bounds":true},{"duplicate_key_count":0,"end_ms":1783468740000,"expected_minute_count":10080,"gap_range_count":0,"instrument_id":37,"missing_minute_count":0,"observed_row_count":10080,"start_ms":1782864000000,"symbol":"FILUSDT","unexpected_timestamp_count":0,"within_registry_lifecycle_bounds":true},{"duplicate_key_count":0,"end_ms":1783468740000,"expected_minute_count":10080,"gap_range_count":0,"instrument_id":53,"missing_minute_count":0,"observed_row_count":10080,"start_ms":1782864000000,"symbol":"CHZUSDT","unexpected_timestamp_count":0,"within_registry_lifecycle_bounds":true},{"duplicate_key_count":0,"end_ms":1783468740000,"expected_minute_count":10080,"gap_range_count":0,"instrument_id":85,"missing_minute_count":0,"observed_row_count":10080,"start_ms":1782864000000,"symbol":"EGLDUSDT","unexpected_timestamp_count":0,"within_registry_lifecycle_bounds":true},{"duplicate_key_count":0,"end_ms":1783468740000,"expected_minute_count":10080,"gap_range_count":0,"instrument_id":101,"missing_minute_count":0,"observed_row_count":10080,"start_ms":1782864000000,"symbol":"WOOUSDT","unexpected_timestamp_count":0,"within_registry_lifecycle_bounds":true},{"duplicate_key_count":0,"end_ms":1783468740000,"expected_minute_count":10080,"gap_range_count":0,"instrument_id":117,"missing_minute_count":0,"observed_row_count":10080,"start_ms":1782864000000,"symbol":"IMXUSDT","unexpected_timestamp_count":0,"within_registry_lifecycle_bounds":true},{"duplicate_key_count":0,"end_ms":1783468740000,"expected_minute_count":10080,"gap_range_count":0,"instrument_id":149,"missing_minute_count":0,"observed_row_count":10080,"start_ms":1782864000000,"symbol":"KAVAUSDT","unexpected_timestamp_count":0,"within_registry_lifecycle_bounds":true},{"duplicate_key_count":0,"end_ms":1783468740000,"expected_minute_count":10080,"gap_range_count":0,"instrument_id":157,"missing_minute_count":0,"observed_row_count":10080,"start_ms":1782864000000,"symbol":"QNTUSDT","unexpected_timestamp_count":0,"within_registry_lifecycle_bounds":true},{"duplicate_key_count":0,"end_ms":1783468740000,"expected_minute_count":10080,"gap_range_count":0,"instrument_id":165,"missing_minute_count":0,"observed_row_count":10080,"start_ms":1782864000000,"symbol":"BANDUSDT","unexpected_timestamp_count":0,"within_registry_lifecycle_bounds":true}],"status":"passed","storage_policy":{"account_data_included":false,"market_values_included":false,"runtime_paths_included":false}}
